{
  "schemaVersion": "fotobeat.project.v1",
  "project": {
    "id": "project-demo-001",
    "title": "Demo Club Recap",
    "createdAt": "2026-06-17T00:00:00.000Z",
    "updatedAt": "2026-06-17T00:05:00.000Z"
  },
  "settings": {
    "presetId": "neon-pulse",
    "formatId": "vertical",
    "clipDurationScale": 1
  },
  "media": {
    "assets": [
      {
        "id": "asset-image-001",
        "type": "image",
        "name": "club-entrance.jpg",
        "size": 1843200,
        "mimeType": "image/jpeg",
        "fingerprint": "club-entrance.jpg:1843200:image/jpeg"
      },
      {
        "id": "asset-image-002",
        "type": "image",
        "name": "dancefloor.jpg",
        "size": 2134200,
        "mimeType": "image/jpeg",
        "fingerprint": "dancefloor.jpg:2134200:image/jpeg"
      },
      {
        "id": "asset-audio-001",
        "type": "audio",
        "name": "beat.mp3",
        "size": 5120000,
        "mimeType": "audio/mpeg",
        "fingerprint": "beat.mp3:5120000:audio/mpeg"
      }
    ]
  },
  "timeline": {
    "durationSeconds": 8,
    "fps": 30,
    "clips": [
      {
        "id": "clip-001",
        "start": 0,
        "duration": 4,
        "assetId": "asset-image-001",
        "section": "intro",
        "effectId": "slow-push"
      },
      {
        "id": "clip-002",
        "start": 4,
        "duration": 4,
        "assetId": "asset-image-002",
        "section": "drop",
        "effectId": "beat-zoom"
      }
    ]
  },
  "snapshots": []
}
